{
  "name": "Qwen3.8 Flash Next",
  "source": "https://huggingface.co/Qwen/Qwen3.8-Flash-Next",
  "verified_at": "2026-10-01",
  "max_tokens": 32768,
  "complex_problem_max_tokens": 81920,
  "hard_limit_reply_budget": 8192,
  "thinking_terminator_hint": "\n\nConsidering the limited time by the user, I have to give the solution based on the thinking directly now.\n</think>\n\n",
  "sampling": {
    "temperature": 1.0,
    "top_p": 0.95,
    "top_k": 20,
    "min_p": 0.0,
    "presence_penalty": 0.0,
    "repetition_penalty": 1.0
  },
  "sampling_no_thinking": {
    "temperature": 0.7,
    "top_p": 0.80,
    "top_k": 20,
    "min_p": 0.0,
    "presence_penalty": 1.5,
    "repetition_penalty": 1.0
  },
  "profiles": {
    "qwen-next-r9700-strix": {
      "summary": "Qwen3.8-Flash-Next with dense work, KV cache and the MTP drafter on an R9700 (gfx1201) and the routed experts on Strix Halo (gfx1151), which also keeps some attention layers' KV cache when the R9700 is full; add --expert-placement with the box's routing stats to also run the most-routed experts on the R9700",
      "gpus": ["gfx1201", "gfx1151"],
      "flags": {
        "--target-device": "hip:0",
        "--expert-device": "hip:1",
        "--max-ctx": "auto"
      }
    }
  },
  "notes": "Thinking-mode sampling from the model card and generation_config.json. The card allows up to 262,144 reasoning + 131,072 answer tokens; max_tokens stays within lucebox context budgets. The 8,192-token reply reserve covers the visible restatement this model writes after a forced close. The terminator is Qwen's budget-forcing text (QwenLM/Qwen3 quickstart). Unsloth UD and bartowski GGUFs report general.name 'Qwen3.8 Flash Next'. `sampling_no_thinking` is the card's instruct (non-thinking) sampling set, applied to requests whose final thinking state resolves to OFF (e.g. chat_template_kwargs.enable_thinking=false, reasoning.effort=\"none\", thinking.type=\"disabled\")."
}
