{
  "name": "Qwen3.8 27B",
  "source": "https://huggingface.co/Qwen/Qwen3.8-27B",
  "verified_at": "2026-10-29",
  "max_tokens": 131072,
  "complex_problem_max_tokens": 262144,
  "hard_limit_reply_budget": 4096,
  "thinking_terminator_hint": "Considering the limited time by the user, I have to give the solution based on the thinking directly now.\n</think>\n\n",
  "default_sampling": "greedy",
  "sampling": {
    "temperature": 1.0,
    "top_p": 0.95,
    "top_k": 20,
    "min_p": 0.0,
    "presence_penalty": 0.0,
    "repetition_penalty": 1.0
  },
  "sampling_no_thinking": {
    "temperature": 0.7,
    "top_p": 0.80,
    "top_k": 20,
    "min_p": 0.0,
    "presence_penalty": 1.5,
    "repetition_penalty": 1.0
  },
  "reasoning_effort_tiers": {
    "low": 15872,
    "medium": 63488,
    "high": 126976,
    "x-high": 192512,
    "max": 258048
  },
  "default_profile": "qwen38-r9700",
  "profiles": {
    "qwen38-r9700": {
      "summary": "Qwen 3.8 27B with its DFlash2 drafter on one R9700 (gfx1201), one request at a time at a 204,800-token context with q8_0 K/V; add --paged-attention --max-concurrency 8 --kv-pool-tokens 204800 to serve eight at once",
      "gpus": ["gfx1201"],
      "flags": {
        "--target-device": "hip:0",
        "--draft-device": "hip:0",
        "--draft-block-size": "16",
        "--max-ctx": "204800",
        "--cache-type-k": "q8_0",
        "--cache-type-v": "q8_0"
      }
    },
    "qwen38-halo": {
      "summary": "Qwen 3.8 27B with its DFlash2 drafter on the Lucebox's Strix Halo (gfx1151, hip:1), leaving the R9700 free: one request at a time at a 204,800-token context with q8_0 K/V",
      "gpus": ["gfx1201", "gfx1151"],
      "flags": {
        "--target-device": "hip:1",
        "--draft-device": "hip:1",
        "--draft-block-size": "16",
        "--max-ctx": "204800",
        "--cache-type-k": "q8_0",
        "--cache-type-v": "q8_0"
      }
    }
  },
  "notes": "Transcribed from the upstream card. Lucebox serves greedy (default_sampling): a request that sets no temperature, or temperature 0, decodes greedily with no penalties, which keeps the drafter on (concurrent DFlash2 drafts only for a request that neither samples nor penalizes). The two sampling blocks are the upstream card's thinking and instruct (non-thinking) recipes; they fill the fields a request leaves out when it sets a temperature above 0. Output length: the card says to set it to 131,072 tokens for a final response and to 262,144 for reasoning content, taken here as max_tokens and complex_problem_max_tokens; the context is 262,144 natively. The tiers are the ratio defaults of docs/specs/thinking-budget.md section 3.3 for those two values, written out as qwen3.6-27b.json does. The terminator hint is the Qwen3 one qwen3.6-27b.json uses (same qwen35 architecture). Lucebox's Qwen 3.8 27B GGUFs report general.name 'Qwen3.8-27B' or 'Qwen3.8 27B', both found as qwen3.8-27b."
}
