{
  "name": "DeepSeek V4.1 Flash",
  "source": "https://huggingface.co/deepseek-ai/DeepSeek-V4.1-Flash-1017",
  "verified_at": "2026-10-29",
  "max_tokens": 204800,
  "hard_limit_reply_budget": 4096,
  "default_sampling": "greedy",
  "sampling": {
    "temperature": 1.0,
    "top_p": 1.0
  },
  "reasoning_effort_tiers": {
    "low": 25088,
    "medium": 100352,
    "high": 200704,
    "x-high": 200704,
    "max": 200704
  },
  "default_profile": ["ds41-r9700-gorgon", "ds41-gorgon", "ds41-halo"],
  "profiles": {
    "ds41-halo": {
      "aliases": ["ds41-lucebox"],
      "summary": "DeepSeek V4.1 Flash on the 128 GB Lucebox: dense work, hot experts and the drafter on the R9700 (gfx1201), a second expert stack on Strix Halo (gfx1151, carve plus locked host memory), the rest streamed from SSD; the Lucebox placement and router bias from share/deepseek41. One request at a time with --draft; for several at once add --paged-attention --max-concurrency N --ds4-prefill sparse, without --draft",
      "gpus": ["gfx1201", "gfx1151"],
      "flags": {
        "--target-device": "hip:0",
        "--expert-device": "hip:1",
        "--peer-access": true,
        "--max-ctx": "204800",
        "--chunk": "4096",
        "--ds4-prefill": "dense",
        "--ds4-expert-placement": "share/deepseek41/placement_lucebox.json",
        "--ds4-router-bias": "share/deepseek41/router_bias_lucebox_40x384_f32.bin",
        "--ds4-protected-experts": "share/deepseek41/massive_experts.json"
      },
      "env": {
        "LUCE_EXPERT_BUDGET_MB": "10500",
        "LUCE_DS4_FUSED_VERIFY": "1",
        "LUCE_DS4_FUSED_HYBRID_DECODE": "1",
        "LUCE_DS4_PINNED_ROLLBACK": "1",
        "LUCE_DS4_TP_ROUTE_PREFORK": "1",
        "LUCE_DS4_TP_DEVICE_JOIN": "1",
        "LUCE_DS4_TP_DEVICE_JOIN_SPLIT": "1",
        "LUCE_DS4_TP_FUSED_HC_JOIN": "1",
        "LUCE_DS4_TP_MAIN_ROUTE_WEIGHTS": "1",
        "LUCE_DS4_TP_COARSE_OWNER": "1",
        "LUCE_DS4_TP_NATIVE_ROUTE_WIDTH": "1",
        "LUCE_DS4_TP_MASKED_ROUTES": "1",
        "LUCE_DS4_TP_GROUPED_MMVQ": "1",
        "LUCE_DS4_TP_CAPTURE_CACHE_SLOTS": "4",
        "LUCE_MOE_FULL_COLD_PARALLEL": "1",
        "GGML_CUDA_BATCH_PEER_COPIES": "1",
        "LUCE_CUDA_MMVQ_MOE_ROWS_PER_BLOCK": "2",
        "LUCE_CUDA_I32_REPEAT": "1",
        "LUCE_DS4_DIRECT_INDEXER_TOPK": "1",
        "GGML_DS4_TOPK_BLOCK_RADIX": "1",
        "ROCBLAS_USE_HIPBLASLT": "0",
        "GPU_MAX_HW_QUEUES": "8"
      }
    },
    "ds41-r9700-gorgon": {
      "summary": "DeepSeek V4.1 Flash on an R9700 (gfx1201) beside a 192 GB Gorgon Halo (gfx1151) with every expert resident: dense work, hot experts and the drafter on the R9700, the other experts on the Gorgon; decoder SWA bounded replay and a pipelined layer-major prefill; pass the expert placement and router bias for the box. One request at a time with --draft; for several at once add --paged-attention --max-concurrency N --ds4-prefill sparse, without --draft",
      "gpus": ["gfx1201", "gfx1151"],
      "min_gpu_memory_gib": [0, 160],
      "notes": "Prefill: bounded replay, layer-major bands with the residual and Engram on the R9700, both owners joined on the device, the Gorgon's cold FFN of one band under the next band's attention, WMMA for plain ROCmFP2 experts, one arena; the cold owner's input crosses PCIe on a side stream. Prefill attention on the R9700's matrix cores: F16 K/V rows into the WMMA D512 kernels (the gfx1151 set; its indexer and causal-window defaults are slower on gfx1201). Decode and verify: F16 K/V on every lane, split-KV flash (eight splits, short lanes included), fused router and HC collapse (both bit-exact). The rest are the ds41-halo owner and kernel settings.",
      "flags": {
        "--target-device": "hip:0",
        "--expert-device": "hip:1",
        "--draft-device": "hip:0",
        "--peer-access": true,
        "--max-ctx": "262144",
        "--chunk": "4096",
        "--ds4-prefill": "dense",
        "--ds4-protected-experts": "share/deepseek41/massive_experts.json"
      },
      "env": {
        "LUCE_EXPERT_BUDGET_MB": "12000",
        "LUCE_DS4_LONG_CONTEXT_CHUNK": "4096",
        "LUCE_DS41_DECODER_BOUNDED_REPLAY": "1",
        "LUCE_DS4_LAYER_MAJOR_DEVICE_RESIDUAL": "1",
        "LUCE_DS4_ENGRAM_DEVICE": "1",
        "LUCE_DS4_SPLIT_DEVICE_JOIN": "1",
        "LUCE_DS4_GROUPED_HYBRID_PREFILL": "1",
        "LUCE_ROCMFP2_WMMA_PREFILL": "1",
        "LUCE_DS4_PREFILL_PIPELINE": "2",
        "LUCE_DS4_PREFILL_ARENA_CHUNK_MB": "0",
        "LUCE_DS4_DEVICE_TOPK": "1",
        "LUCE_MOE_SIDE_COPY": "1",
        "LUCE_DS4_PREFILL_F16_KV_ALL": "1",
        "GGML_CUDA_MLA_STREAM_WMMA": "1",
        "GGML_CUDA_MLA_STREAM_WMMA_HEAD_GROUPS": "2",
        "GGML_CUDA_MLA_DENSE_WMMA": "1",
        "GGML_CUDA_MLA_DENSE_HIGH_RATIO": "1",
        "LUCE_DS4_HYBRID_F16_VERIFY_KV": "1",
        "LUCE_DS4_F16_KV_LANES": "1",
        "GGML_CUDA_MLA_SPLIT_KV": "1",
        "GGML_CUDA_MLA_SPLIT_KV_COUNT": "8",
        "LUCE_DS4_EXPLICIT_SPLIT": "1",
        "LUCE_DS4_FUSE_ROUTER": "1",
        "LUCE_DS4_FUSE_COLLAPSE": "1",
        "LUCE_DS4_MASK_F16_ONCE": "1",
        "LUCE_DS4_SPEC_Q": "5",
        "LUCE_DS4_Q5_VERIFY": "1",
        "LUCE_DS4_COMP_PAD_STRIDE": "128",
        "LUCE_DS4_ADAPTIVE_WIDTH": "1",
        "LUCE_DS4_FUSED_VERIFY": "1",
        "LUCE_DS4_FUSED_HYBRID_DECODE": "1",
        "LUCE_DS4_PINNED_ROLLBACK": "1",
        "LUCE_DS4_TP_ROUTE_PREFORK": "1",
        "LUCE_DS4_TP_DEVICE_JOIN": "1",
        "LUCE_DS4_TP_DEVICE_JOIN_SPLIT": "1",
        "LUCE_DS4_TP_FUSED_HC_JOIN": "1",
        "LUCE_DS4_TP_MAIN_ROUTE_WEIGHTS": "1",
        "LUCE_DS4_TP_COARSE_OWNER": "1",
        "LUCE_DS4_TP_NATIVE_ROUTE_WIDTH": "1",
        "LUCE_DS4_TP_MASKED_ROUTES": "1",
        "LUCE_DS4_TP_GROUPED_MMVQ": "1",
        "LUCE_DS4_TP_CAPTURE_CACHE_SLOTS": "4",
        "LUCE_MOE_FULL_COLD_PARALLEL": "1",
        "GGML_CUDA_BATCH_PEER_COPIES": "1",
        "LUCE_CUDA_MMVQ_MOE_ROWS_PER_BLOCK": "2",
        "LUCE_CUDA_I32_REPEAT": "1",
        "LUCE_DS4_DIRECT_INDEXER_TOPK": "1",
        "GGML_DS4_TOPK_BLOCK_RADIX": "1",
        "ROCBLAS_USE_HIPBLASLT": "0",
        "GPU_MAX_HW_QUEUES": "8"
      }
    },
    "ds41-gorgon": {
      "summary": "DeepSeek V4.1 Flash on a 192 GB Gorgon Halo (gfx1151) alone, the whole model resident on the iGPU (166 GiB for the 1017 ROCMFP2S file); dense batched prefill, the ROCmFP2 WMMA expert prefill and the fused router and HC collapse on top of the gfx1151 defaults. Not yet measured on a 192 GB board. One request at a time with --draft; for several at once add --paged-attention --max-concurrency N --ds4-prefill sparse, without --draft",
      "gpus": ["gfx1151"],
      "min_gpu_memory_gib": [160],
      "notes": "On one GPU, dense or sparse prefill loads V4.1 fully resident (the hybrid expert tier comes only with --expert-device or exact prefill), so the expert placement, router bias and --ds4-protected-experts, which act on that tier, are left out. Resident size is the GGUF minus its Engram tables (about 190 GiB, read from the file and never mapped): 166 GiB for DeepSeek-V4.1-Flash-1017-ROCMFP2S-IM1017.gguf, plus the drafter (4.6 GiB for the Q2K-Q4K one), the KV cache and the prefill buffers (about 4 GiB). The context is 131,072 tokens, half of ds41-r9700-gorgon's, so the KV cache takes about 1.6 GiB and the total stays near the 176 GiB GTT limit of the measured Gorgon; if the model does not load, raise that limit or lower --max-ctx. Of ds41-r9700-gorgon's switches the ROCmFP2 WMMA prefill and the fused router and HC collapse apply on one GPU; the others move work between two GPUs, and bounded replay runs on the hybrid path.",
      "flags": {
        "--target-device": "hip:0",
        "--max-ctx": "131072",
        "--chunk": "4096",
        "--ds4-prefill": "dense"
      },
      "env": {
        "LUCE_ROCMFP2_WMMA_PREFILL": "1",
        "LUCE_DS4_FUSE_ROUTER": "1",
        "LUCE_DS4_FUSE_COLLAPSE": "1"
      }
    }
  },
  "notes": "Transcribed from the upstream card's recommended parameters, except max_tokens, which is Lucebox's. Lucebox serves greedy (default_sampling): a request that sets no temperature, or temperature 0, decodes greedily. The sampling block is upstream's recipe, temperature 1.0 and top_p 1.0, for the fields a request leaves out when it sets a temperature above 0. max_tokens is 204800, the context of the 128 GB Lucebox (the ds41-halo profile), since every V4.1 Flash setup shares this card (upstream gives a 1M-token context window and max_tokens of 256K or more). The card states no effort budgets, so the tiers are the ratio defaults of docs/specs/thinking-budget.md section 3.3 for that max_tokens (no complex-problem value, so x-high and max equal high), written out; each is capped at max_ctx minus hard_limit_reply_budget. top_k, min_p and the penalties are absent because the card does not state them. Lucebox's V4.1 Flash GGUFs report general.name 'DeepSeek V4.1 Flash'."
}
